{
  "$schema": "https://json-schema.org/draft/2020-12/schema",
  "title": "Hermes worker runtime configuration",
  "type": "object",
  "$defs": {
    "adapter": {
      "type": "object",
      "required": ["kind"],
      "properties": {
        "kind": {"enum": ["mock", "cxh-run", "codex-run", "claude-agent", "hybrid", "brainstorm"]},
        "runner_path_env": {"type": "string"},
        "authorized_roots_env": {"type": "string"},
        "cli_path_env": {"type": "string"},
        "execution_profiles": {"type": "array", "items": {"type": "string"}},
        "task_types": {"type": "array", "items": {"type": "string"}},
        "max_turns": {"type": "integer", "minimum": 1, "maximum": 50},
        "subscription_only": {"type": "boolean"},
        "primary_engine": {"enum": ["claude", "codex"]},
        "review_engine": {"enum": ["codex", "claude"]},
        "max_review_rounds": {"type": "integer", "minimum": 0, "maximum": 3},
        "claude_engine": {"type": "string", "minLength": 1},
        "codex_engine": {"type": "string", "minLength": 1}
      },
      "additionalProperties": false
    }
  },
  "required": ["controller_url", "worker"],
  "oneOf": [
    {"required": ["token_env"]},
    {"required": ["token_file"]}
  ],
  "properties": {
    "controller_url": {"type": "string"},
    "token_env": {"type": "string", "minLength": 1},
    "token_file": {"type": "string", "minLength": 1},
    "state_file": {"type": "string"},
    "task_materialization_roots_env": {"type": "string"},
    "enabled": {"type": "boolean"},
    "adapter": {"$ref": "#/$defs/adapter"},
    "integrations": {
      "type": "object",
      "properties": {
        "github_api": {
          "type": "object",
          "required": ["token_env"],
          "properties": {"token_env": {"type": "string", "minLength": 1}},
          "additionalProperties": false
        }
      },
      "additionalProperties": false
    },
    "adapters": {
      "type": "object",
      "minProperties": 1,
      "propertyNames": {"enum": ["codex", "claude", "hybrid", "native", "brainstorm"]},
      "additionalProperties": {"$ref": "#/$defs/adapter"}
    },
    "default_execution_engine": {"enum": ["codex", "claude", "hybrid", "native"]},
    "heartbeat_interval_ms": {"type": "integer", "minimum": 1, "default": 30000},
    "retry_backoff_ms": {"type": "integer", "minimum": 1},
    "max_backoff_ms": {"type": "integer", "minimum": 1},
    "worker": {"$ref": "hermes-worker.schema.json"}
  },
  "additionalProperties": false
}
